id,name,ability,firstNightReminder,otherNightReminder,remindersGlobal,reminders
acrobat,Acrobata,"A cada noite*, se algum de seus vizinhos vivos do bem estiver bêbado ou envenenado, você morre.",,"Se algum dos vizinhos bons do Acrobata está bêbado ou envenenado, o Acrobata morre.",,Morto
alchemist,Alquimista,Você tem a habilidade de um Lacaio que não está em jogo.,Mostre ao Alquimista um token de um Lacaio que não esteja em jogo.,,é o Alquimista,
alhadikhia,Al-Hadikhia,"A cada noite*, escolha 3 jogadores (todos sabem quem são): em silêncio, cada alvo decide se vive ou morre, mas se todos viverem, todos morrem.",,"O Al-Hadikhia escolhe 3 jogadores. Anuncie o primeiro jogador. Acorde-o para sinalizar 'sim' ou 'não' com a cabeça indicando se quer viver ou morrer respectivamente. Mate ou reviva comforme a escolha. Adormeça o jogador, anuncie o próximo alvo e repita o processo até ter passado por todos os 3 alvos. Após isso, se os 3 ainda vivem, todos os 3 morrem.",,"1,2,3,Morte,Vida"
amnesiac,Esquecido,"Você não sabe qual é a sua habilidade. A cada dia, visite o Narrador para tentar adivinhar a sua habilidade: saiba o quão perto está da resposta.",Decida a habilidade do Esquecido. Se a habilidade do Esquecido faz com que ele acorde esta noite: Acorde o Esquecido e execute sua habilidade.,Se a habilidade do Esquecido faz com que ele acorde esta noite: Acorde o Esquecido e execute sua habilidade.,,?
angel,Anjo,Algo ruim pode acontecer com quem for o maior responsável pela morte de um jogador novato.,,,,"Protegido,Algo Ruim"
apprentice,Aprendiz,"Na sua primeira noite, você ganha uma habilidade de Cidadão (se for do bem), ou de Lacaio (se for do mal).","Mostre ao Aprendiz o token 'Você é', e um token de Cidadão ou Lacaio. No Grimório, substitua o token do Aprendiz com o daquele personagem e coloque o lembrete 'É o Aprendiz' próximo a ele.",,,É o Aprendiz
artist,Artista,"Uma vez por jogo, durante o dia, em segredo, faça uma pergunta de 'sim ou não' para o Narrador.",,,,Sem habilidade
assassin,Assassino,"Uma vez por jogo, à noite*, escolha um jogador: ele morre mesmo que, por alguma razão, não possa morrer.",,"Se o Assassino ainda não usou a habilidade: o Assassino pode sinalizar 'não' com a cabeça, ou escolher um jogador: o alvo morre, mesmo que algo impeça isso.",,"Morto,Sem habilidade"
atheist,Ateísta,"O Narrador pode quebrar as regras do jogo e, se executado, o bem vence, mesmo se você estiver morto. [Sem jogadores do mal]",,,,
balloonist,Balonista,"A cada noite, saiba um jogador de um tipo de personagem diferente, até que você saiba um jogador para cada tipo de personagem possível. [+1 Forasteiro]",Escolha um tipo de personagem. Aponte para um jogador cujo personagem é desse tipo. Coloque o lembrete 'Visto' do Balonista ao lado desse personagem.,"Escolha um tipo de personagem que você ainda não escolheu. Informe ao Balonista um jogador cujo personagem é desse tipo, se houver algum. Coloque o lembrete 'Visto' do Balonista ao lado desse personagem.",,"Cidadão Visto,Demônio Visto,Forasteiro Visto,Lacaio Visto,Viajante Visto"
barber,Barbeiro,"Se você morreu hoje (de dia ou de noite), o Demônio poderá escolher dois jogadores (exceto outro Demônio): eles trocam de personagens entre si.",,Se o Barbeiro morreu hoje: Acorde o Demônio. Mostre o token 'Você foi alvo desta habilidade' e o token do Barbeiro. O Demônio pode recusar usar a habilidade do Barbeiro ou escolher 2 jogadores que não sejam Demônio. Se ele escolher jogadores: Troque as fichas de personagem dos alvos. Acorde cada jogador escolhido. Informe-os quais são seus novos personagens.,,Cortes de Cabelo hoje
barista,Barista,"A cada noite, até o anoitecer, 1) um jogador fica sóbrio, desenvenenado e ganha informações verdadeiras, ou 2) a habilidade de um jogador funciona 2x. O jogador afetado sabe o efeito.","Escolha um jogador, acorde-o e mostre-o qual poder do Barista o está afetando (1 ou 2).","Escolha um jogador, acorde-o e mostre-o qual poder do Barista o está afetando (1 ou 2).",,"Habilidade 2x,Sóbrio e Desenvenenado"
baron,Barão,Há Forasteiros adicionais em jogo. [+2 Forasteiros],,,,
beggar,Pedinte,"Você precisa de um token de voto para votar. Jogadores mortos podem escolher doar os deles a você. Caso façam, saiba o alinhamento deles.",,,,
bishop,Bispo,Apenas o Narrador pode nomear. Pelo menos 1 jogador do alinhamento oposto ao seu será nomeado a cada dia.,,,,"Nomear bom,Nomear mau"
bonecollector,Coletor de Ossos,"Uma vez por jogo, à noite, escolha um jogador morto: ele recupera a habilidade até o anoitecer.",,"O Coletor de Ossos pode sinalizar 'não' com a cabeça ou apontar para um jogador morto. Se apontar para um jogador morto, marque o alvo com o token 'Tem habilidade' e marque o Coletor de Ossos com o token 'Sem habilidade'.",,"Sem habilidade,Tem habilidade"
boomdandy,Boomdandy,"Se você for executado, todos morrem, exceto 3 jogadores. 1 minuto depois, o jogador que estiver sendo apontado pelo maior número de jogadores morre.",,,,
bountyhunter,Caçador de Recompensas,"Você começa o jogo sabendo 1 jogador do mal. Quando esse jogador morrer, saiba outro jogador do mal esta noite. [1 Cidadão é do mal]","Antes da partida começar, escolha um cidadão para ser mau. Escolha um dos jogadores maus para ser Caçador de Recompensas. Informe ao Cidadão mau sobre o allinhamento dele no início da primeira noite. Acorde o Caçador de Recompensas e aponte para o jogador marcado como alvo.","Cado o alvo do Caçador de Recompensas esteja morto ou tenha se tornado bom, mude o alvo para outro jogador mau, acorde o Caçador de Recompensas e aponte para o novo alvo.",,Alvo
buddhist,Budista,"Durante os primeiros 2 minutos de cada dia, jogadores veteranos não podem falar.",,,,
bureaucrat,Burocrata,"A cada noite, escolha um jogador (exceto você): o voto dele vale por 3 amanhã.",O Burocrata escolhe um jogador. Coloque o lembrete '3 Votos' do Burocrata ao lado do token de personagem do jogador escolhido.,O Burocrata escolhe um jogador. Coloque o lembrete '3 Votos' do Burocrata ao lado do token de personagem do jogador escolhido.,,3 Votos
butcher,Açougueiro,"A cada dia, depois da 1ª execução, você pode nomear novamente.",,,,
butler,Mordomo,"A cada noite, escolha um jogador (exceto você): amanhã, você só poderá votar enquanto ele estiver votando também.",O Mordomo escolhe um jogador. Marque aquele jogador como 'Mestre'.,O Mordomo escolhe um jogador. Marque aquele jogador como 'Mestre'.,,Mestre
cannibal,Canibal,"Você tem a habilidade do jogador executado mais recente. Se ele for do mal, você fica envenenado até um jogador do bem morrer por execução.",,,,"Envenenado,Habilidade adquirida"
cerenovus,Cerenovus,"A cada noite, escolha um personagem do bem e um jogador: o alvo deve alucinar ser esse personagem amanhã, ou pode ser executado.","O Cerenovus escolhe um jogador e um personagem bom. (lembrete) Coloque o Cerenovus para dormir. Acorde o alvo. Mostre o token 'Você foi alvo desta habilidade', o token do Cerenovus e o token do personagem escolhido.","O Cerenovus escolhe um jogador e um personagem bom. (lembrete) Coloque o Cerenovus para dormir. Acorde o alvo. Mostre o token 'Você foi alvo desta habilidade', o token do Cerenovus e o token do personagem escolhido.",,Alucinando
chambermaid,Camareira,"A cada noite, escolha 2 jogadores vivos (exceto você): saiba quantos acordaram esta noite pelas próprias habilidades.",A Camareira aponta para dois jogadores vivos. Mostre com os dedos o número que indica quantos desses dois acordaram esta noite pelas próprias habilidades.,A Camareira aponta para dois jogadores vivos. Mostre com os dedos o número que indica quantos desses dois acordaram esta noite pelas próprias habilidades.,,
chef,Chef,Você começa sabendo quantos pares de jogadores do mal existem.,Faça um número com os dedos.,,,
choirboy,Coroinha,"Se o Demônio matar o Rei, saiba qual jogador é o Demônio. [+Rei]",,"Se o Rei foi morto pelo Demônio, acorde o Coroinha e aponte para o jogador que é o Demônio.",,
clockmaker,Relojoeiro,Você começa sabendo a quantos passos o Demônio está de seu Lacaio mais próximo.,Mostre o número com os dedos.,,,
courtier,Cortesão,"Uma vez por jogo, à noite, escolha um personagem: ele fica bêbado por 3 noites e 3 dias.","O Cortesão pode sinalizar 'não' com a cabeça, ou apontar para um personagem na ficha. Se o Cortesão usou a habilidade, e o personagem estiver em jogo, o alvo fica bêbado.","Reduza a quantidade de dias restantes do jogador bêbado. Se o Cortesão ainda não usou a habilidade: O Cortesão pode sinalizar 'não' com a cabeça, ou apontar para um personagem na ficha. Se o Cortesão usou a habilidade, e o personagem estiver em jogo, o alvo fica bêbado.",,"Bêbado 1,Bêbado 2,Bêbado 3,Sem habilidade"
cultleader,Líder da Seita,"A cada noite, o seu alinhamento será igual ao de um de seus vizinhos vivos. Se todos os jogadores do bem aderirem à seita, seu time vence.","Escolha um vizinho vivo do Líder da Seita, O alinhamento do Líder da Seita agora é igual ao do vizinho escolhido. Se o Líder da Seita mudou o seu alinhamento, acorde-o e informe-o sobre o alinhamento atual dele.","Escolha um vizinho vivo do Líder da Seita, O alinhamento do Líder da Seita agora é igual ao do vizinho escolhido. Se o Líder da Seita mudou o seu alinhamento, acorde-o e informe-o sobre o alinhamento atual dele.",,
damsel,Donzela,"Todos os Lacaios sabem que você está em jogo. Se um Lacaio advinhar quem você é publicamente (uma chance), seu time perde.","Acorde todos os Lacaios, mostre o token 'Este personagem está em jogo' e o token da Donzela.","Se a Donzela foi escolhida pelo Caçador, acorde-a e mostre o token 'Você é' e o token de um Cidadão de fora do jogo.",,Chance usada
deusexfiasco,Deus ex Fiasco,"Uma vez por jogo, o Narrador cometerá um ""erro"", corrigí-lo e admitir publicamente.",,,,Whoops
deviant,Divergente,"Se você foi divertido hoje, não morrerá se for exilado.",,,,
devilsadvocate,Advogado do Diabo,"A cada noite, escolha um jogador vivo (sem repetir o da noite anterior): se o ele for executado amanhã, não morrerá.",O Advogado do Diabo aponta para um jogador vivo: o alvo sobrevive à execução amanhã.,"O Advogado do Diabo aponta para um jogador vivo, diferente do alvo da noite anterior: Esse jogador sobrevive à execução amanhã.",,Sobrevive à execução
djinn,Djinn,Use a regra especial do Djinn (jinx). Todos sabem qual é.,,,,
doomsayer,Agoureiro,"Se 4 ou mais jogadores estiverm vivos, cada jogador vivo pode (uma vez por jogo) pedir que um jogador do mesmo alinhamento morra.",,,,
dreamer,Sonhador,"A cada noite, escolha um jogador (exceto você ou Viajantes): saiba 1 personagem do bem e 1 do mal, um deles é o correto.","O Sonhador escolhe um jogador. Mostre 1 personagem do bem e 1 do mal, sendo 1 deles o personagem do jogador escolhido.","O Sonhador escolhe um jogador. Mostre 1 personagem do bem e 1 do mal, sendo 1 deles o personagem do jogador escolhido.",,
drunk,Bêbado,"Você não sabe que é o Bêbado. Você acha que é um Cidadão, mas não é.",,,Bêbado,
duchess,Duquesa,"A cada dia, 3 jogadores podem escolher visitar você. À noite*, cada visitante vê quantos dos visitantes são do mal, mas um deles recebe a informação falsa.",,,,"Informação Falsa,Visitante"
empath,Empático,"A cada noite, saiba quantos de seus 2 vizinhos vivos são do mal.",Faça um número com os dedos.,Faça um número com os dedos.,,
engineer,Engenheiro,"Uma vez por jogo, à noite, você pode decidir quais Lacaios ou qual Demônio está em jogo.","O Engenheiro sinaliza 'não' com a cabeça, ou aponta na ficha de personagens para um Demônio ou para uma quantidade de Lacaios (conforme o número de jogadores). Se o Engenheiro fizer isso, troque os personagens, conforme escolhido, e acorde os jogadores correspondentes para informá-los sobre a mudança.","Se o Engenheiro ainda não usou a habilidade, o Engenheiro sinaliza 'não' com a cabeça, ou aponta na ficha de personagens para um Demônio ou para uma quantidade de Lacaios (conforme o número de jogadores). Se o Engenheiro fizer isso, troque os personagens, conforme escolhido, e acorde os jogadores correspondentes para informá-los sobre a mudança.",,Sem habilidade
eviltwin,Gêmea Má,"Você e um oponente se conhecem. Se o jogador do bem for executado, o Mal vence. O Bem não pode vencer enquanto ambos viverem.",Acorde as gêmeas. Deixe que façam contato visual. Mostre o token de personagem da Gêmea Má para sua gêmea e vice-versa.,,,Gêmea
exorcist,Exorcista,"A cada noite*, escolha um jogador (sem repetiro da noite anterior): o Demônio, se escolhido, sabe quem você é e não age esta noite.",,O Exorcista aponta para um jogador (diferente do escolhido na noite anterior). Se esse jogador é o Demônio: acorde o Demônio. Mostre o token de personagem do Exorcista. Aponte para o jogador Exorcista. O Demônio não age esta noite.,,Escolhido
fanggu,Fang Gu,"A cada noite*, você escolhe um jogador: ele morre. O primeiro Forasteiro a ser morto assim, torna-se um Fang Gu do mal e você morre em vez dele. [+1 Forasteiro]",,"O Fang Gu escolhe um jogador. O alvo morre. Ou, se esse jogador for o Primeiro Forasteiro escolhido por um Fang Gu no Jogo: • O Fang Gu morre em vez do alvo. O alvo agora é um Fang Gu mau. • Acorde o novo Fang Gu. Informe-o que ele é um Fang Gu mau. Esta troca não poderá mais acontecer durante este jogo.",,Morto
farmer,Fazendeiro,"Se você morrer à noite, um jogador do bem vivo se torna um Fazendeiro.",,"Se um Fazendeiro morreu esta noite, escolha outro jogador do bem vivo, transforme-o em Fazendeiro, acorde-o e informe-o sobre a mudança.",,
fearmonger,Amedrontador,"A cada noite, escolha um jogador. Se você nomeá-lo e executá-lo, o time dele perde. Todos sabem quando você faz uma escolha diferente.",O Amedrontador aponta para um jogador. Marque o escolhido com o lembrete 'Medo' e anuncie que um jogador foi alvo da habilidade do Amendrontador.,"O Amedrontador aponta para um jogador. Marque o escolhido com o lembrete 'Medo'. Se a escolha for diferente da noite anterior, anuncie que um novo jogador foi escolhido pelo Amedrontador.",,Medo
fibbin,Mentiroso,"Uma vez por jogo, 1 jogador bom pode receber informações falsas.",,,,Usado
fiddler,Violinista,"Uma vez por jogo,o Demônio escolhe secretamente um oponente: todos votam para decidir qual dos 2 vence.",,,,
fisherman,Pescador,"Uma vez por jogo, durante o dia, visite o Narrador para obter conselhos de como vencer.",,,,Sem habilidade
flowergirl,Florista,"A cada noite*, saiba se um Demônio votou hoje.",,"Sinalize 'sim' ou 'não' com a cabeça para indicar se o Demônio votou. Coloque o lembrete 'Demônio não votou' (remova 'Demônio votou', se for o caso).",,"Demônio não votou,Demônio votou"
fool,Bobo,"Na 1ª vez que você for morrer, você não morre.",,,,Sem habilidade
fortuneteller,Vidente,"A cada noite, escolha 2 jogadores: saiba se algum deles é um Demônio. Há um jogador do bem que é registrado como Demônio para você.",A Vidente escolhe dois jogadores. Sinalize com a cabeça (sim ou não) para indicar se algum destes jogadores é o Demônio (ou a *PISTA FALSA*).,A Vidente escolhe dois jogadores. Sinalize com a cabeça (sim ou não) para indicar se algum destes jogadores é o Demônio (ou a *PISTA FALSA*).,,Pista Falsa
gambler,Apostador,"A cada noite*, escolha um jogador e tente adivinhar o personagem dele: se errar, você morre.",,"O Apostador aponta para um jogador e para um personagem na ficha. Se o personagem não corresponder ao jogador escolhido, o Apostador morre.",,Morto
gangster,Gangster,"Uma vez por dia , você pode escolher matar um vizinho vivo, desde que o seu outro vizinho vivo concorde.",,,,
general,General,"A cada noite, saiba qual time o Narrador acredita que está vencendo: Bem, Mal ou nenhum.","Informe ao General qual time você acha que está vencendo usando seu polegar: Bem (polegar para cima), Mal (polegar para baixo) ou nenhum (polegar para o lado).","Informe ao General qual time você acha que está vencendo usando seu polegar: Bem (polegar para cima), Mal (polegar para baixo) ou nenhum (polegar para o lado).",,
goblin,Goblin,"Quando nomeado, você pode publicamente alegar ser o Goblin: Se for executado naquele dia, seu time vence.",,,,Alegou hoje
godfather,Chefe da Máfia,"Você começa sabendo quais Forasteiros estão em jogo. Se um Forasteiro morreu hoje de dia, escolha um jogador esta noite: o alvo morre. [−1 ou +1 Forasteiro]",Mostre cada token de Forasteiro em jogo.,Se um Forasteiro morreu hoje durante o dia: O Chefe da Máfia aponta para um jogador. Esse jogador morre.,,"Morreu de dia,Morto"
golem,Golem,"Você só pode nomear uma vez por jogo. Quando o fizer, o nomeado morre se não for o Demônio.",,,,Não pode nomear
goon,Capanga,"A cada noite, o 1º jogador que escolher você com a própria habilidade fica bêbado até o anoitecer. Você passa a a ter o mesmo alinhamento que ele.",,,,Bêbado
gossip,Fofoqueiro,"A cada dia, você pode fazer uma alegação publicamente. Esta noite, se a alegação era verdadeira, um jogador morre.",,Se a alegação pública do Fofoqueiro era verdadeira: mate um jogador,,Morto
grandmother,Vovó,"Você começa sabendo o personagem de um jogador do bem. Se o Demônio matá-lo, você também morre.",Mostre o token de personagem do jogador marcado como 'Neto'. Aponte para o jogador marcado.,Se o 'Neto' da Vovó foi morto pelo Demônio esta noite: A Vovó morre.,,Neto
gunslinger,Pistoleiro,"A cada dia, após a 1ª contagem de votos, você pode escolher um jogador que votou: ele morre.",,,,
harlot,Meretriz,"A cada noite*, escolha um jogador vivo: se ele concordar, saiba o personagem dele, mas ambos podem morrer.",,"A Meretriz aponta para um jogador. Adormeça a Meretriz e acorde o alvo. Mostre o token 'Você foi alvo desta habilidade' e o token da Meretriz. O jogar pode sinalizar 'sim' ou 'não' com a cabeça. Se o alvo sinalizou 'sim', Acorde a Meretriz e mostre o token de personagem do alvo. Então decida se ambos morrem.",,Morto
harpy,Harpia,"A cada noite, escolha 2 jogadores: amanhã o 1º alucina que o 2º é mal, ou ambos podem morrer.","Acorde a Harpia; ela aponta para um jogador, depois outro. Acorde o 1º jogador que a Harpia apontou, mostre o token 'Você foi alvo desta habilidade' e o token da Harpia, aponte para o 2º jogador escolhido.","Acorde a Harpia; ela aponta para um jogador, depois outro. Acorde o 1º jogador que a Harpia apontou, mostre o token 'Você foi alvo desta habilidade' e o token da Harpia, aponte para o 2º jogador escolhido.",,"Alucinando, 2º"
hellslibrarian,Bibliotecário do Inferno,Algo ruim pode acontecer com quem falar quando o Narrador pedir silêncio.,,,,Algo Ruim
heretic,Herege,"Quem vence perde e quem perde vence, mesmo se você estiver morto.",,,,
highpriestess,Suma Sacerdotisa,"A cada noite, aprenda qual jogador O Narrador mais acredita que você deva conversar.",Aponte para um jogador.,Aponte para um jogador.,,
huntsman,Caçador,"Uma vez por jogo, à noite, escolha um jogador vivo. O alvo, se for a Donzela se torna um Cidadão fora de jogo. [+Donzela]","O Caçador sinaliza 'não' com a cabeça, ou aponta para um jogador. Se apontar para a Donzela, mude o personagem do alvo para um Cidadão que não esteja em jogo. Avise o alvo sobre a troca.","O Caçador sinaliza 'não' com a cabeça, ou aponta para um jogador. Se apontar para a Donzela, mude o personagem do alvo para um Cidadão que não esteja em jogo. Avise o alvo sobre a troca.",,Sem habilidade
imp,Capeta,"A cada noite*, escolha um jogador: ele morre. Se você se matar desta forma, um Lacaio se torna Capeta.",,O Capeta escolhe um jogador. :reminder: Se o Capeta escolher a si mesmo: Substitua o token de personagem de um Lacaio vivo por um token de Capeta sobrando. Coloque o antigo Capeta para dormir. Acorde o novo Capeta mostrando o token *VOCÊ É* seguido do token do Capeta.,,Morto
innkeeper,Estalajadeiro,"A cada noite*, escolha 2 jogadores: eles não podem morrer esta noite, mas um deles fica bêbado até o anoitecer.",,Remova os tokens de 'Protegido' e 'Bêbado'. O Estalajadeiro aponta 2 jogadores. Os alvos ficam protegidos da morte esta noite.Escolha um para marcar com o lembrete 'Bêbado'.,,"Bêbado,Protegido"
investigator,Investigador,Você começa sabendo que 1 dentre 2 jogadores é um Lacaio específico.,Mostre o token de personagem Lacaio. Aponte para os jogadores *LACAIO* e *ERRADO*.,,,"Errado,Lacaio"
judge,Juíz,"Uma vez por jogo, se outro jogador nomear, você pode forçar essa execução ou impedí-la.",,,,Sem habilidade
juggler,Malabarista,"Em seu primeiro dia, você pode tentar adivinhar publicamente até 5 personagens de até 5 jogadores. Á noite, você descobre quantos você acertou.",,Se hoje foi o primeiro dia do Malabarista e este usou sua habilidade:Mostre com os dedos o número de acertos.,,Correto
king,Rei,"A cada noite, se os mortos são maioria, saiba um personagem vivo. O Demônio conhece você.","Acorde o Demônio, mostre o token do Rei e aponte para o jogador correspondente.","Se a maioria dos jogadores está morta, mostre oao rei o token de um personagem vivo.",,
klutz,Desastrado,"Quando souber que morreu, escolha publicamente um jogador vivo: se ele for do mal, o seu time perde.",,,,
knight,Cavaleiro,Você começa sabendo 2 jogadores que não são O Demônio.,Aponte para 2 jogadores que não são O Demônio.,,,"Sabe, Sabe"
legion,Legião,"A cada noite*, um jogador pode morrer. Execuções irão falhar se apenas jogadores do mal votarem. Você também é registrado como Lacaio.[Maioria dos jogadores é Legião]",Informe a todos os jogadores que sejam Legião quem são os outros Legião. Você decide quantos e quais Legião recebem blefes.,"Se ao menos um membro da Legião estiver sóbrio, escolha um jogador, esse jogador morre.",,"Morto,Prestes a morrer"
leviathan,Leviatã,"Se mais de um jogador do bem for executado, o Mal vence. Todos sabem que você está em jogo. Após o dia 5, o Mal vence.",Coloque o lembrete 'Dia 1'. Anuncie ao amanhecer: “O Leviatã está em jogo; este é o primeiro dia ”.,"Coloque o lembrete com o número do dia que irá amanhecer. Se ainda não anunciou que o Leviatã está em jogo, faça isso ao amanhcer, anunciando também o número correspondente ao dia.",,"Bom Executado,Dia 1,Dia 2,Dia 3,Dia 4,Dia 5"
librarian,Bibliotecária,Você começa sabendo que 1 dentre 2 jogadores é um Forasteiro específico.(Ou que há 'zero' Forasteiros em jogo.),Mostre o token de personagem Forasteiro. Aponte para os jogadores *OUTSIDER* e *ERRADO*.,,,"Errado,Forasteiro"
lilmonsta,Bebê Monstro,"A cada noite os Lacaios escolhem quem cuidará do Bebê Monstro e será ""o Demônio"". A cada noite*, um jogador morre. [+1 Lacaio]","Todos os Lacaios acordam ao mesmo tempo e escolhem um jogador para ficar do token do Bebê Monstro. Este jogador 'é o Demônio', mas mantém seu alinhamento e personagem.","Todos os Lacaios acordam ao mesmo tempo e escolhem um jogador para ficar do token do Bebê Monstro. Este jogador 'é o Demônio', mas mantém seu alinhamento e personagem. Então escolha um jogador para morrer.","Demônio,Morto",
lleech,Parasita,"A cada noite*, escolha um jogador: ele morre. Você começa escolhendo um jogador vivo: ele fica envenenado - você morre se e somente se este jogador morrer.",O Parasita aponta para um jogador. Marque-o com o lembrete 'Envenenado'.,O Parasita aponta para um jogador: o alvo morre.,,"Morto,Envenenado"
lunatic,Lunático,"Você pensa que é um Demônio, mas você não é. O Demônio conhece você e quem você escolhe à noite.","Caso este jogo tenha etapa de informação do Demônio, realize esta etapa com o Lunático dando informações arbitrárias. Se o Demônio acordaria hoje para receber informações ou fazer escolhas, faça o mesmo com o Lunático (informações arbitrárias). Acorde o Demônio, Mostre o token do Lunático e aponte para o jogador correspondente. Informe quaisquer alvos que o Lunático tenha escolhido com sua habilidade falsa.","Se o Demônio acordaria hoje para receber informações ou fazer escolhas, faça o mesmo com o Lunático (informações arbitrárias). Acorde o Demônio e informe quaisquer alvos que o Lunático tenha escolhido com sua habilidade falsa.",,"Ataque 1,Ataque 2,Ataque 3"
lycanthrope,Licantropo,"A cada noite*, escolha um jogador vivo: se ele for do bem, morre, mas somente esse jogador poderá morrer essa noite.",,"O Licantropo escolhe um jogador vivo: se o alvo for bom, morre e ninguém mais pode morrer esta noite. Se por algum motivo o jogador escolhido for bom, mas não morrer, ahabilidade do Licantropo não impede outras mortes esta noite.",,Morto
magician,Mágico,O Demônio pensa que você é um Lacaio. Lacaios pensam que você é um Demônio.,,,,
marionette,Marionete,"Você pensa que é um personagem bom, mas não é. O Demônio conhece você. [Você é vizinho do Demônio]","Acorde o Demônio, mostre o token da Marionete e aponte para o jogador correspondente.",,É a Marionete,
mastermind,Mentor,"Se o jogo terminaria por causa da execução do Demônio, o jogo dura mais 1 dia em vez disso. Se, então, um jogador for executado, o time dele perde.",,,,
mathematician,Matemático,"A cada noite, você descobre quantas habilidades funcionaram de forma anormal (desde o amanhecer) devido a habilidades de outros personagens.",Mostre o número com os dedos.,Mostre o número com os dedos.,,Anormal
matron,Matrona,"A cada dia, você pode trocar até 3 duplas de jogadores de lugar. Jogadores não podem deixar seus lugares para falar em particular.",,,,
mayor,Prefeito,"Se apenas 3 jogadores estão vivos e não houver execução, o seu time vence. Se você for morrer à noite, outro jogador pode morrer em vez disso.",,,,
